PatentNum,Date,Title,Text
5106641,1992,Apparatus and method for waterless rotary cleaning and peeling food      products and the like,"Apparatus for cleaning and peeling food products, such as fruits and vegetables, without the use of water, comprises a stationary housing in which a motor-driven brush cage is rotatably mounted. The cage comprises a plurality of cylindrical roller brushes radially arranged about a generally horizontal (but slightly downward slope) axis to define a generally cylindrical product-processing chamber. A rotatable product inlet tube at the chamber inlet end directs the product into the product chamber. A motor rotatably drives the inlet tube and the cage in one direction and, through a stationary ring gear and pinion gears on the brushes, causes each brush to rotate in the opposite direction. The inlet tube has vanes inside which impart initial rotary motion to the product entering the chamber. Product accumulating in the chamber forms a single layer against the wall of the chamber as it is advanced therethrough, making contact with substantially all the rotating brushes which effect cleaning and peeling. Waste materials are ejected between adjacent rollers into the housing and are expelled through a waste opening in the bottom of the housing, whereas the finished product exits the outlet end of the chamber. No water is used in processing the product, but the interior of the housing can be flushed with water to remove waste therefrom."
5169076,1992,Crushing tool,"A crusher comprises a housing defining a crushing chamber for restraining an object to be crushed and a plunger for applying force on the object to be crushed when the plunger is actuated by a handle. The handle is mounted on the housing for pivotal movement about a first floating pivot in a first pivotal direction which actuates a first engaging element to move the plunger in a first direction to crush the object in the crushing chamber. The plunger is locked against resilient return in a second direction by a second engaging element. Further pivotal movement of the handle about a second floating pivot in a second pivotal direction actuates the disengagement of the second engaging element, causing the return of the plunger."
5092231,1992,Nut cracker,"A nut cracker is designed to accommodate virtually any size nut and provide the same degree of cracking stroke with the same mechanical advantage irrespective of nut size, with only a simple thumb-screw adjustment of a cam."
5115733,1992,Nut shelling machine,"A nut cracking machine constructed to crack nuts of different size in a continuous operation is provided, the machine having first and second disks that are spaced apart with opposed tapered faces forming a narrowing gap therebetween, the first disk being rotated on a first axis and the second disk being rotated together with the first disk on a second axis slightly skewed from the first axis such that the face of one disk is oblique to the face of the other disk and when rotated together, the gap between the faces of the disks has a wide sector and a narrow sector. The machine includes a feed mechanism to feed nuts of different size to the space between the disks where the space is widest, the nuts advancing between the tapered faces until the nuts are engaged by the disks and are then transported to where the gap narrows, the disks compressing the nuts therebetween and cracking the shells."
5174026,1992,Nutcracker with compartmented receptacle,"A nutcracking apparatus includes a nutcracker and a compartmented receptacle. The receptacle if formed having side walls, end walls and a floor, with a support wall dividing the receptacle into a nut compartment and a smaller shell compartment. A support platform is mounted to the support wall and includes an overhang portion into the nut compartment to provide an adequate base for absorbing the force applied for cracking nuts. A cracking pad is mounted on the support platform which includes a recess for receiving and supporting a nut to be cracked. A cracking lever arm is pivotally mounted to the support platform and includes a notch aligned with the recess for engaging a nut between the cracking pad and the lever arm. Also supported on the support platform is an end containment wall, a side containment wall and an opposite shell-directing wall for controlling shell fragments during the cracking process. The shell-directing wall is longer than the side containment wall and is disposed between the nutcracking location and the nut compartment so that shell fragments are directed away from the nut compartment and into the shell compartment. The nutcracking apparatus of the present invention is particularly usable by persons with impairment of hand motor skills."
5097597,1992,Spiral nutcracker/grinder,"A tool for the exertion of firm, well-modulated, compressional and shear force, ideally suited to the removal of nutshells by hand. An inclined surface moves alongside another surface, creating a V-shaped gap. Such movement will cause materials to be gripped, rolled, and crushed. This pair of surfaces is curved end-to-end around a central axis so that one becomes a circular cylinder, while the other assumes the form of a spiral curve, either around or within the first. One part rotates in relation to the other upon the central axis. The rotary-drum embodiment comprises a spiral curve (a), the ends joined by a convex arc (a), the resulting shape extended to form a cylinder. A web () spans one end of the cylinder to form a cup (). The web serves to retain materials () being worked (such as edible nuts), as well as to support a central spindle () upon which a drum (a) is turned by means of a key-shaped handle (). The opposing surfaces ( and ) of the spiral and the drum are textured to hold the material more firmly as it is worked."
4996917,1991,Apparatus for splitting closed shell pistachio nuts,"There is provided an apparatus for splitting closed pistachio nuts in a controlled manner such that the longitudinal sutures of the nuts will be cracked open. The apparatus includes a cylindrical housing wih a mandrel mounted for rotation therein to provide an annulus into which nuts can be introduced. According to various features of the apparatus, the pistachio nuts are rotated, oriented and then split along their sutures in the annulus and subsequently discharged through an opening in the housing. There is also provided a continuous process of treating closed shell pistachio nuts which includes the step of removing the denser foreign particles from the closed shell nuts by flotation; and a soaking step so that the shells of the unopened pistachio nuts will be saturated with water to provide a degree of shell flexibility such that when pressure is applied to the suture of the shell to effect splitting, the shell will flex rather than crack. The shells are subsequently surface dried and then introduced to a splitting operation of the type carried out by the apparatus previously described."
5052107,1991,Chestnut cutter,"The present invention, a hand held Chestnut Cutter which is adaptable for all sizes of the chestnuts. This cutter is similar in shape and system to a hand held garlic press or nut cracker. Nut cutter is comprised of a pair of levers which are pivotally joined together at their front ends, or center by a bolt or pin. The upper lever carries a cutting blade and the lower lever has a cavity for receiving the chestnut and has opening at the bottom for tail of chestnut. To cut the chestnut, place the chestnut in the lower lever ring, and push down the upper lever blade towards the chestnut and it will cut the top of the shell."
4993155,1991,Frustumic press,"A gripping device with a plurality of rods, pivotably engaged to at least two plates. As the plates are rotated in opposite directions, the distance between rods is changed. One specific embodiment of the invention functions as a pecan cracker. A pecan placed within the perimeter of the rods, between the plates, will, upon sufficient rotation be grasped by the closing rods. Upon sufficient farther rotation, the pecan shell will crack. Control over the force applied is usually sufficient to properly crack the shell without breaking the meat of the pecan."
5070617,1991,Hand cracker for nuts,"A hand cracker for nuts, particularly thick shelled macadamia nuts, the cracker having a receptacle with a bottom and a side wall for receiving a nut to be cracked with an off-center cracking shaft with wedge blades arranged circumferentially around the shaft and a crank device to rotate the shaft and wedge the nut between the wedge blades of the shaft and the wall of the receptacle wherein the nut is cracked by the force of the wedge action of the wedge blades."
5012580,1991,Macadamia nutcracker employing sliding force arm driven by lever with      fixed end and floating intermediate pivots,"A nutcracker for macadamia or other hard nuts () comprises an elongated slide bar () having an anvil jaw () attached to a working end thereof, a parallel elongated arm () having a mating jaw () attached to a working end thereof, and a hand lever () which has a pair of pivots (B, ) at one end thereof. The pivots on the hand lever are attached to force-applying ends of the arm () and bar (), respectively, which are opposite to their working ends. The jaw on the bar has a portion () which extends around the bar so that the arm is held and will be forced to move only in a direction which is generally parallel to the bar. The anvil jaw on the bar is adjustable in position and is urged to the jaw on the arm by a spring (). The parts are shaped and the pivots are positioned such that rotation of the hand lever from an open position where it makes a wide angle with the arm and bar to a position where it makes a narrow angle causes the arm to move parallel to the bar with tremendously multiplied force, which actually continually increases as the angle narrows. The device can be post mounted (FIG. ), portable (FIG. ), bowl mounted (FIG. ), or surface mounted."
5076158,1991,Nutcracker apparatus,"An apparatus wherein a platform mounts an electric drive for selective use and cooperation with a manual crank to rotate a drum supporting shaft to rotate a drum in cooperation with a chute, wherein the chute includes a convex grinding surface to receive members therethrough to grind such members in cooperation with a multi-lobed drum. The drum lobes are optionally provided for selective replacement utilizing lobes of a multi-ribbed construction in cooperation with an initial and primary shell cracking rib."
4964215,1990,Apparatus for cracking a melon seed,An apparatus for cracking the hull of a melon seed. The apparatus includes a flat plate and a pair of cracking members pivoted to the flat plate. A protrusion projects from the surface at which the cracking members are located. The cracking members have two clamping edges which face each other and are adapted to clamp the tapered end of the melon seed to be cracked while the round end of the melon seed abuts the protrusion by moving the cracking members toward each other. The apparatus is provided with two spring members for urging the cracking members to move away from each other to a position at which the melon seed may be released.
4909140,1990,Apparatus for splitting closed shell pistachio nuts,"There is provided an apparatus for splitting closed pistachio nuts in a controlled manner such that the longitudinal sutures of the nuts will be cracked open. The apparatus includes a cylindrical housing with a mandrel mounted for rotation therein to provide an annulus into which nuts can be introduced. According to various features of the apparatus, the pistachio nuts are rotated, oriented and then split along their sutures in the annulus and subsequently discharged through an opening in the housing. There is also provided a continuous process of treating closed shell pistachio nuts which includes the step of removing the denser foreign particles from the closed shell nuts by flotation; and a soaking step so that the shells of the unopened pistachio nuts will be saturated with water to provide a degree of shell flexibility such that when pressure is applied to the suture of the shell to effect splitting, the shell will flex rather than crack. The shells are subsequently surface dried and then introduced to a splitting operation of the type carried out by the apparatus previously described."
4907840,1990,"Combined hassock, nutcracker and disposal unit","A combination hassock, nutcracker and disposal kit is disclosed and includes a container having an open and a closed end with a cushioned removable top serving to close the open end. A nutcracker is attached to a part-circular shelf and a pliable shield serves to prevent shell frgments from being expelled from container during a nut cracking procedure. A plurality of screws extend transversely through the sidewall of container to engage the arcurate portion of shelf for retention thereof within container . A removable tray is positioned on shelf and serves as a storage area for uncracked nuts, condiments, etc. Discarded shell fragments may be swept or scraped off shelf into lower compartment of container for retention therein until it is convenient to dispose of them. Cushioned removable top , shelf and container are each provided with a decorative vinyl coating for aesthetic purposes. One or more handles assist in moving hassock to a desired location and also assist in up-ending container when it is desired to empty the contents therein for disposal. One or more strapes provide a snap-on connection to releasably secure removable top to container ."
4961947,1990,Method for splitting closed shell pistachio nuts,"There is provided an apparatus for splitting closed pistachio nuts in a controlled manner such that the longitudinal sutures of the nuts will be cracked open. The apparatus includes a cylindrical housing with a mandrel mounted for rotation therein to provide an annulus into which nuts can be introduced. According to various features of the apparatus, the pistachio nuts are rotated, oriented and then split along their sutures in the annulus and subsequently discharged through an opening in the housing. There is also provided a continuous process of treating closed shell pistachio nuts which includes the step of removing the denser foreign particles from the closed shell nuts by flotation; and a soaking step so that the shells of the unopened pistachio nuts will be saturated with water to provide a degree of shell flexibility such that when pressure is applied to the suture of the shell to effect splitting, the shell will flex rather than crack. The shells are subsequently surface dried and then introduced to a splitting operation of the type carried out by the apparatus previously described."
4980188,1990,Method for splitting closed shell pistachio nuts,"There is provided an apparatus for splitting closed pistachio nuts in a controlled manner such that the longitudinal sutures of the nuts will be cracked open. The apparatus includes a cylindrical housing with a mandrel mounted for rotation therein to provide an annulus into which nuts can be introduced. According to various features of the apparatus, the pistachio nuts are rotated, oriented and then split along their sutures in the annulus and subsequently discharged through an opening in the housing. There is also provided a continuous process of treating closed shell pistachio nuts which includes the step of removing the denser foreign particles from the closed shell nuts by flotation; and a soaking step so that the shells of the unopened pistachio nuts will be saturated with water to provide a degree of shell flexibility such that when pressure is applied to the suture of the shell to effect splitting, the shell will flex rather than crack. The shells are subsequently surface dried and then introduced to a splitting operation of the type carried out by the apparatus previously described."
4944091,1990,Nut splitting device,A manually operated nutcracking device with a threaded member for urging carrier and a wedge thereon into nut engagement to split the nut. A base includes a pair of guides and a nut supporting member. The carrier includes plate components coupled to the wedge in a detachable manner. The plate components are recessed to engage the inner edges of the pair of guides. A foot on the threaded member imparts travel to the carrier.
4928590,1990,Nutcracker,"Disclosed is a nutcracker comprising at least one rotary disk with sharp teeth on its circumference blade, and a stator plate with sharp teeth on its curved blade, said stator plate being positioned with its curved blade in confronting relation with the rotary disk blade, leaving the gap between the curved blade and the disk blade, setting narrower downstream."
4959236,1990,Process for removing pellicle from nut meats,"The present invention provides a novel process for removing the pellicle from nut kernels and a blanching composition for use in the treatment of nuts. More particularly, the process of the invention comprises the steps of: (a) immersing nut kernels in a composition comprising a mixture of a vegetable oil and a wetting agent in a solution of water and, optionally, a sugar, at ambient temperature to soften and loosen the pellicle; (b) removing the nut kernels from the composition and draining the nut kernels; (c) exposing the nut kernels to ambient temperature water to remove the pellicle; and (d) separating the nut kernels from the pellicle."
4944219,1990,Torsion leverage nutcracker,A nutcracker includes upper and lower endplates and a plurality of rod members loosely interfitted with apertures in the endplates. Adjacent ones of the rod members interfitted to one of the endplates are widely spaced to admit nuts into a nut envelope defined by the rod members. Relative rotation of the endplates enables the cracking of the nut within the nut envelope.
4819331,1989,Apparatus for cracking the husks of nuts,"Disclosed is an apparatus for cracking the husks of nuts comprising a cylindrical rotor having a plurality of cracking projections on its circumference, a semicircular suspension stator having a plurality of cracking projections on its inner surface, the stator being positioned against a corresponding sector of the cylindrical rotor with a downward decreasing gap left between the stator and the rotor, and a hopper with an opening at the bottom for dispensing nuts to the gap between the stator and the rotor. The nutcracker according to the present invention permits simultaneous cracking of nuts of different sizes at an increased efficiency."
4848220,1989,Electric powered nut cracker,An electric powered portable nutcracker is provided that includes an actuator for forcing a piston to move in a direction toward a stationary jaw to crack a nut so that the broken shells can fall into a compartment in the base. The nutcracker can be structured so that it will separate the nut from the cracked shells into two different segments of the compartment in the base.
4843715,1989,Lever actuated nutcracker,"A nutcracking apparatus having a base and a member attached at the bottom thereof to the front and top portions of the base and extending upwardly therefrom. A first nut contacting blade is attached to the one side of the member. An elongated plunger has a second nut contacting blade attached to one end thereof and guide structure is provided for reciprocally mounting the plunger to the base to cause the plunger to stay in the same path during reciprocation between a first position and a second position for cracking the nut. A handle is pivotally attached at one end thereof to the other end of the plunger along the first axis and a cantilever structure is rigidly attached at one end thereof to one end of the handle and extends in one direction away from the first axis. A link member is pivotally attached at one end thereof along a second axis to the other end of the cantilever and at the other end thereof to a top portion of the guide structure, whereby pivotal movement of the handle from a first position thereof to a second position thereof causes a corresponding movement of the plunger from the first to the second position thereof, thereby opening a nut which has been placed between the blades."
4838155,1989,Nutcracker apparatus,"The nutcracker apparatus includes a frame on which there is provided a front and a rear head assembly that each has a head which is resiliently urged toward the other but is limited in such movement by a knife at least in part located in a slot in the head. Each knife is mounted on a rod, the rear rod being movable toward the front rod to initially clamp the nut and as the movement of one head toward the other is limited by the uncracked nut, the rear knife continues to move toward the front knife to crack and/or split the nut. In one embodiment the rear knife is mounted by the rear rod which is moved forwardly by a pivotal handle moving binder members into binding engagement against the rear rod. In the second embodiment the rear rod is a piston rod of a piston cylinder combination that is operated automatically to crack a nut as the nut is dropped between the heads."
4805527,1989,Shell-cracking apparatus for hard-shell coated seeds,"Disclosed is a shell-cracking apparatus for hard-shell coated seeds including a hopper in which the seeds of pine nuts are put. When a seed-receiving plate is vibrated by driving a motor in this state, the seeds enter the grooves of that plate. Thereafter, the seeds are guided downwards into an outer cylindrical member via a cylindrical seed-discharging member into which they have dropped from said plate. At, or at around, this time, a cock of an air injection pipe is opened. A compressed air is injected from a small air injection bore of an air injection pipe supporting plug member into the outer cylindrical member. The seeds are thereby quickly forced into a funnel portion of a seed ejection pipe supporting plug member. Then, while the seeds pass through the seed ejection pipe, which is slightly larger in diameter than the longitudinal sizes of the seeds, the seeds fly with their pointed ends toward the advancing direction of the seeds, until they violently collide against the central holes formed in a pad plate, perhaps because the air stream is greater in speed around the center of the pipe than on the inner peripheral surfaces of the pipe."
4831733,1989,Solenoid type nutcracker,"A piston type nutcracker with two movable jaws. A connecting rod which is threaded and atached to piston jaw and is adjustable to adapt to different size nuts. The two movable jaws move in a horizontal position until the jaws and nut enter the chamber, thereby enclosing the nut so there is no scattered shell or shell dust when nut is cracked. The solenoid is to be connected to a source of electric power and may be energized by a switch. A nut support member has a through opening which is between the jaw members in their spaced position to crack a nut and for movement to discharge a nut into a container disposed below the jaw members after the shell cracking is completed."
4768693,1988,Canister opener,"A hand-operated canister opener tool, and method, for opening a frangible, plastic-walled, hollow canister (such as one containing a cryptographic, secret, military code) having two pivotally connected elements carrying a canister piercing member for piercing the canister to examine its contents before discard, and a canister receiving member surrounding the canister for safety during piercing for preventing ejection of shrapnel-like, sharp, plastic chips likely to cause bodily injury."
4773323,1988,Device for shelling nuts,"A process for shelling nuts, particularly pistachio nuts, includes the step of slowly and continuously compressing the nuts in the longitudinal direction and not increasing the compression at the moment when the shells break. This compression can preferably be effected in the longitudinal direction with the aid of two rotating disks arranged to be slightly inclined relative to each other."
4793248,1988,Nut shelling machine,"A nut shelling machine in which a rotary drive mechanism operates a rotary feed mechanism and a rotary shelling mechanism, the shelling mechanism having a frame with four shafts arranged in spaced, side by side, upper and lower pairs, the shafts having surface lobes and indentions for enlarging and contracting the effective space between the upper pair and lower pair of shaft for accepting and trapping a nut between the pair of upper shafts and lower shafts, where it is shelled by a shafting implement before the shell and nut passes between the pair of lower shafts."
4787307,1988,Nutcracker,"A nutcracker, mounted on a base, grips a nut to be cracked between a movable piston and an adjustable anvil. The user sets the optimum cracking distance initially by lining up an index marker located on the piston and adjusting the anvil to firmly hold the opposite end of the nut. Thereafter, the user need only move the lever handle to its up position and insert the nut--no further adjustment of the anvil is necessary for similar sized nuts. The user then moves the piston a limited distance by activating the lever handle connected to the piston through a toggle joint, or by some other limited-movement arrangement. This limited movement enables the inventive nutcracker to crack the nutshell without damaging the meat inside."
