PatentNum,Date,Title,Text
6516714,2003,Nut cracking apparatus,"The present invention is a nut cracker apparatus that will successfully and efficiently crack nuts and separate the meat from the shell. To enable successful cracking the present invention comprises a housing having an inlet and outlet. Interiorly located in the housing is a rotatable horizontally disposed drum. A shaft having a plurality of paddles extends centrally through the drum. Secured to the wall of the drum is a plurality of removable screens. Nuts are fed to the inlet into the rotatable drum. During rotation, the paddles impart a force on the nuts causing them to crack and having the shells dislodge from the meat. The screens enable the appropriately sized meat to fall therethrough."
6609303,2003,Pistachio nut opener for splitting open pistachio nut shells,"A hand held pistachio nut opener for splitting open pistachio nut shells and removing the edible nut from the opened half shells comprises forwardly directed upper and lower protruding members having forward distal edges adapted to be inserted in the lateral peripheral separation between the half shells of the pistachio nut to split open the half shells. The upper protrusion member is operative to open upwardly relative to the stationary lower protrusion member. The upper forward protrusion member is secured to a rearward extension member operatively rotatable about an interconnecting means secured to a rearward extension means of the stationary lower protrusion member. A spring bias means maintains the movable upper protrusion in closed engagement with the stationary lower protrusion, but is operative in response to compressive thumb pressure applied rearwardly to the upper rotatable extension member to rotate the upper protrusion member upwardly away from the lower stationary protrusion member and operative to separate and split open the half shells of the pistachio nut."
6647866,2003,Processing device for coffee beans,"A processing device for coffee beans to undergo a de-husking, bean-halving, membrane removing and roasting device to proceed with a de-husking, bean-halving, membrane removing and roasting step of coffee beans, wherein the de-husking, bean-halving and membrane-removing device comprises: a first beating mechanism having a plurality of rotating blades with hard rubber at the surface thereof to beat and remove the dried husk, flesh and inner skin of coffee beans; a second beating mechanism having a plurality of rotating blades with soft rubber at the surface thereof to beat and remove the silvery skin of the inner layer of the bean; a first separating mechanism mounted with a lower for separating the coffee bean from skin and debris; and the roasting device including a rolling container mounted with a spiral conductive plate and a burner at the bottom section of the rolling container for roasting of coffee beans after the coffee beans have been de-husked, halved and membrane-removed for appropriate stiring for evenly roasting."
6634283,2003,Skin loosening or removal apparatus,"Apparatus for loosening or removing the skin from products such as nut kernels, beans, seeds or the like. Carriers are arranged to receive the products and a liquid jet manifold is adapted to direct jet or jets at the products. In a preferred embodiment, the products are disposed in an annular recess in a carrier, and are subjected to jets of liquid discharged from two nozzles at each end of a bar arranged to rotate above the recess."
6397737,2002,Nutcracking apparatus,"A nutcracking apparatus including a housing having opposing sidewalls. A hammer plate having an upper and lower portion is pivotally attached at its upper portion to the opposing sidewalls of the housing. A camshaft is positioned in abutment with a lower portion of the hammer plate, and a drive attached to an outer end of the cam shaft for effecting rotation thereof. An anvil plate having an upper and lower portion is spaced from the hammer plate is pivotally attached at its upper portion to the opposing sidewalls of the housing. A device is provided for moving the lower portion of the anvil plate towards and away from the lower portion of the hammer plate."
6412405,2002,Peeling device for the inner-embryo membrane of coffee bean,"A device inside a grinder to peel the inner embryo membrane of coffee beans is disclosed. It has a motor with a motor shaft, a positioning cylinder located on the lateral side of a motor and having a lower exit inside a conveyor base, and a conveyor base, which is on the lateral side of the grinder and has an extruded exit end on the other side of the grinder. The motor shaft connects to an eccentric synchronic rotation grinding bar. During rotation, the grinding surface completely hits the inner ring rim of the positioning cylinder and coffee beans are ground into particles. When the particles fall, due to low specific weight, the embryo membrane is drawn by a fan located on the lateral wall of a grinder and is collected in a dust collection bag."
6422137,2002,Pistachio huller,An apparatus for separating hulled and unhulled pistachios includes a rotating roller and a conveyor for depositing pistachios onto the roller. Rotation of the drum frictionally separates hulled and unhulled pistachios.
6378213,2002,Pistachio sheller,A pistachio sheller including a base having an upwardly extending shaft with a flat narrow blade adapted to be received in the crack of a pistachio shell. A cylinder is rotatably attached to the base and includes an oval-shaped top opening adjacent the flat narrow tip. A pistachio shell is received in the oval opening with the crack directed down to engage the blade. Rotation of the base with respect to the cylinder splits the pistachio shell open.
6205915,2001,Apparatus for cracking nuts at high production rates,"A high production nutcracking apparatus wherein the nuts are fed from a hopper on a feed conveyor which has an upwardly inclined segment which passes through the hopper, a horizontal segment which leads to the cracking apparatus, and an arcuate transition juncture which is between the two segments. The nuts are singularized and oriented while being advanced on the feed conveyor, by means of a free floating covering plate which continuously overlies the feed conveyor from a point along the upwardly inclined segment, along the transition juncture, and to a delivery point where the nuts are lifted from the conveyor by a cracking apparatus. The cracking apparatus comprises a plurality of cracking units mounted on a rotatable turret, and the rotating cracking units are cyclically controlled so as to clampingly engage and lift each oriented nut from the advancing conveyor, and so as to preserve its orientation. Each nut is then cracked and thereafter released at separate spaced points along the circular path of travel of the cracking unit. The elevation of the feed conveyor relative to the cracking apparatus can be adjusted to accommodate nuts of different sizes."
6182562,2001,Cracking die assembly for high production nutcracking apparatus,"A cracking die assembly which is adapted for use in a high production nutcracking apparatus of the type wherein a nut is held between an anvil and a cracking die, and a shuttle then impacts against the rear end face of the cracking die to sharply advance the cracking die and thereby crack the shell of the nut. The cracking die assembly includes a mounting sleeve having a bore with an internal shoulder, and a tubular retainer mounted within a portion of the sleeve bore so as to engage the shoulder of the sleeve. An annular gasket is fixedly mounted in the bore of the retainer, and the cracking die is mounted in the bore of the retainer, and the cracking die has a radial flange which is positioned to lie between the shoulder in the bore of the sleeve, and the gasket. Also, the gasket and radial flange have conforming conical surfaces which engage when the cracking die is impacted by the shuttle, to thereby absorb the impacting force of the shuttle."
6224932,2001,Cryogenic rheological modification of tree nuts,"A method and apparatus for cryogenic rheological modification of tree nuts and other shelled foodstuffs wherein brief cryogenic exposure facilitates further processing, particular shell removal. Nuts from a bin () of conditioned nuts are transported by a conveyor () to a cryogenic dip (). The nuts are then conveyed by a conveyor () to a cracker feeder chain () to a cracker unit ()."
6270824,2001,High production nutcracking apparatus having improved alignment capability,"A high production nutcracking apparatus wherein the nuts are fed from a hopper on a feed conveyor to a cracking apparatus. The cracking apparatus is in the form of a plurality of cracking units mounted on a rotatable turret, and the rotating cracking units are cyclically controlled so as to clampingly engage and lift each oriented nut from the advancing conveyor, and so as to preserve its orientation. Each nut is then cracked and thereafter released at separate spaced points along the circular path of travel of the cracking unit. A structure and procedure for aligning the cracking units of the turret with respect to the feed conveyor is disclosed."
6209448,2001,Nut cracking machine,"A nut cracking machine comprises a cylinder mounted in bearings for rotation about a long axis of the cylinder. The cylinder has projections extending radially from its cylindrical surface. An anvil plate is held at a fixed predetermined distance from the cylinder when the machine is in operation. The cylinder is power driven. A feed hopper is provided for receiving nuts and directing the nuts onto the cylinder, the cylinder rotating in a direction to direct an upper part of the cylinder toward the anvil plate member, toward an increasingly restricted space between the cylinder and the anvil plate."
6237476,2001,Nutcracker,"A novelty nutcracker device which comprises a tubular housing having a side wall thereby defining an elongated passageway, and a first end cap removably connected at a first end of the passageway, a reciprocally moveable impact member mounted within the elongated passageway, a handle connected to the impact member, the impact member being biased towards the first end cap, and an opening in the side wall to permit the insertion of a nut to be cracked therein. The device is preferably packaged in an exterior envelope having the form of a sports article or an animal character."
6247396,2001,Nutcracker with adjusting wedge mechanism,"A nutcracker is described herein which comprises: a frame; an anvil and hammer movably mounted to the frame; a wedge ramp in a fixed relationship to the frame and having a substantially planar surface; a sliding wedge having opposing, substantially planar surfaces of which one surface is in sliding and flush contact with the surface of the wedge ramp, and the other surface is in contact with the anvil; a striker movably mounted to the frame for striking the hammer; and an anvil and hammer control device for moving the sliding wedge along the wedge ramp while in contact with the anvil so as to move the anvil relative to the hammer from an open position, in which ends of the hammer are at a maximum distance from one another to allow a nut to be received therebetween, to a closed position in which such ends are closed securely upon the nut, whereupon the control device causes the striker to strike the hammer and move it toward the anvil a predetermined distance to thereby crack the nut."
6041697,2000,Apparatus for controlled cracking of nut-like fruits and the like,"An apparatus for the controlled fracture of the outer hull of a nut-like fruit wherein a reciprocable piston is moved within a frame and is supported and guided by arms that interfit with the piston to guide it or non-rotating movement into and out of engagement with the nut-like fruit. A key actuator is rotated by the user and which rotates an actuator, threadedly interengaged with the frame and which serves to provide the reciprocable movement of the piston. The nut hull is itself positioned between the piston and an anvil that among the surfaces of the piston and anvil that crack the nut hull are both configured so as to retain the nut in a stable position where it can be acted upon by the apparatus. In an alternate embodiment, the apparatus is modified so as to act as a garlic press using the same piston constrained motion. In a still further embodiment. the apparatus is modified so as to operate as a corkscrew to safely and easily remove the corks from bottles such as wine bottles."
6076454,2000,Apparatus for separating the outer layers or shells from the internal      seed of plant matter,"An apparatus for separating outer layers or shells from the internal seed of plant matter comprises a plant matter inlet (), a seed outlet () and a generally vertical separating chamber () interposed between the inlet and outlet. The separating chamber is cylindrical and includes a plurality of axially spaced apart inwardly facing nozzles () and a plurality of spaced apart apertures (). The apertures are a size smaller than the seeds being separated to allow only the outer layer or shells to pass therethrough. A separating chamber includes a plurality of inclined to horizontal baffles () to increase the residence time in the plant matter in the chamber."
6009799,2000,Apparatus for splitting pistachios,A system for splitting pistachios including an adjustable splitter assembly including plungers driven by cams. The cams are frictionally slidable on a rotating camshaft to allow snubbing of the plungers against the nuts. Cavities on the splitter jaw and plungers include relief holes to avoid crushing of the ends of the nuts and encourage an appropriate split. Cushions between the plungers and cam followers reduces impact on the pistachios.
6106390,2000,Dehusking apparatus,A dehusking apparatus is provided having a fixed cage like housing and a conveyor within the housing for transporting produce from an inlet to an outlet. The conveyor has helical flights with an intermediate portion being covered by a flexible covering between which and the inside of the cage the produce may travel to be dehusked as the produce is conveyed through the apparatus.
6041504,2000,"Device to progressively break the woody shell, particularly of fruits of      the drupe type","A device for progressively breaking the woody shell on fruits of the drupe type includes a double handle, of which a first handle is static and second handle is dynamic. The first handle includes a spoon-shaped seat to hold the fruit whose shell is to be broken and the seat has a longitudinal opening along its center. The second handle is connected to the first handle by a pivot and a movable breaking blade is also connected by the pivot to the two handles. The movable breaking blade is provided with a ratchet in the form of a wheel with teeth around its periphery. The ratchet progressively moves the blade so as to surpass the spoon-shaped seat through the longitudinal opening. The blade moves in response to the dynamic handle acting on a first pawl that engages with the teeth of the wheel. The blade also includes an elastic recall which operates to return the blade to an original position when the blade is released by a second pawl provided on the first handle that engages with the teeth at a point diametrically opposite to the first pawl."
6098530,2000,Mechanical nut cracker,"A mechanical nut cracker for a machine having an adjustably positioned crushing plate and crusher bar for cracking various types of nuts. The mechanical nut cracker includes a crusher assembly having a crusher bar rotationally attached to an end of a base member. The crusher assembly further includes a pair of side walls and a slanted back wall extending upwardly from the crusher bar and between the side walls. A crusher plate assembly is adjustably coupled to the base member for positioning in spaced relationship to the crusher bar. The crusher plate assembly includes a crusher plate, a pair of plate assembly side walls, and a slanted front wall extending up from the crusher plate and between the plate assembly side walls. The crusher plate assembly further includes a pair of arms extending outwardly for adjustably engaging the base member."
6035772,2000,Nut cracking apparatus,"An apparatus for cracking nuts is disclosed which employs a striker mechanism to apply a sharp force to the shell of a nut in order to fracture it. The nut is held in a chamber consisting of an anvil and a cup, with a spring-loaded striker being cocked and released by the single motion of a lever. In the lever's normal raised state, the anvil and cup are separated to allow for insertion of the uncracked nut. As the lever is lowered, the anvil is gently closed down upon the nut to secure it with a light force between the anvil and the cup. As the lever continues its travel downward, the striker is cocked and released, imparting an impulse force on the cup and the nut, thereby cracking the shell of the nut with a predetermined force independent of the size of the nut. A fragment shield integral to the lever is lowered into place along either side of the cracking chamber as the lever is lowered, providing a simple and reliable safety mechanism. The shell, shards, and nut meat are directed to a catch bowl below the cracking chamber as the lever is raised and as the anvil releases the cracked nut."
6125743,2000,Nut processing apparatus,"An apparatus for processing hard-shelled nuts and a method therefore. A nut processing apparatus has a plurality of mechanical grippers moving in a continuous loop, each gripper configured to carry a nut through a plurality of processing stations. A conveyor system sequentially transports single nuts from a hopper to a position where the mechanical grippers may engage each nut and begin the processing cycle. Once engaged, the grippers carry the nuts to a grooving station where a grooving blade is brought into contact with the shells of the nuts. Once the grooving blade is in contact with the shells, the grippers rotate the nuts one complete revolution, thereby cutting a groove in the peripheries of the nuts. The grippers then carry the nuts to a splitting station, where splitting blades are brought into contact with the shells of the nuts where the grooves have been cut, thereby splitting the shell into two parts. The grippers carry the split shell to a collecting station where the shell is separated and the nut kernel is collected for processing. The shells are carried by the grippers to a dumping station where the shells are discarded. The grippers then engage another nut and the process continues with the various nuts in the plurality of grippers being simultaneously processed at different stations."
6135020,2000,Nut sheller bypass,"In a plant for mass mechanical shelling of nuts having a cracker, sheller, and air separators, this process bypasses the sheller with some cracked nuts. Nuts and nut parts created in the cracker are sent to bypass structure where in successive operations, the nuts are separated by width then by thickness. Those nuts having the largest width are shelled by parallel rubber coated cylinders. The remaining nut parts having smaller thickness/width ratios bypass the sheller of the prior art. Parts having larger thickness/width ratios are sent to the sheller of the prior art. The process is performed by screens which separate the cracked nut parts by width. For each width of nut parts, slots between revolving cylinders, separate the larger thickness parts from the smaller thickness parts."
6151782,2000,Nutcracker,"A device for cracking the shells of fruit, such as in particular walnuts, of the type comprising two elements adapted to pivot, by one of their respective ends, about a transverse pin, comprising a fruit-gripping area adjacent to the pivot axis in which the fruit, whose shell it is desired to crack, is placed. This device is characterized in that at least the inner face of one of these elements is covered, at least in part, with an elastically deformable product."
6052906,2000,Nutcracker,"The nutcracker has two handles which can be pivoted toward each other about a pin. The one handle is connected to a basket for receiving a nut. The other handle is designed as a pressing handle, its end region being constructed as the pressing part. An insert part can be inserted into this end region for opening small nuts. The basket is provided with an aperture through which the end region of the pressing handle can run directly into the basket. A good squeezing result (opening of the nut) can be achieved. The rear basket wall is preferably closed off in order to prevent the nut from falling out when being placed in. The spacing between the pressing part and the basket wall is selected in such a way that a crushing of the nut is not possible."
6135021,2000,Nutcracker,"A nutcracker comprising an anvil, an impact member, the anvil and the impact member being arranged to receive a nut therebetween for cracking, a striking member, and a guiding device for guiding the impact member in a movement towards and away from said anvil and for guiding the striking member in a movement towards and away from said impact member, wherein the striking member is arranged to be forced by its own weight against the impact member under the attraction of gravity so as to impart a cracking force to the shell of a nut received between said impact member and said anvil."
5926957,1999,Compression tool,"A compression tool for use in applying compression with a predetermined limited movement to a workpiece. The tool includes first and second lever arms with workpiece engaging surfaces and adjacent hinged ends. When compressing a workpiece, e.g., a nut, the hinged ends are urged apart, and a stop face is moved into the pathway of a stop edge on one of the lever arms to limit the movement of the arms toward each other."
5871800,1999,Method for bleaching nuts,A method and apparatus for bleaching the shells of in-shell nuts and for bleaching the meats of shelled nuts involves wetting the nuts with an alkaline solution and then with a peroxygen solution. The two substances react to form a bleaching agent which whitens the shell or nut meat. Slight mechanical brushing may be used to dislodge debris loosened by the process. The apparatus includes means for recycling the reagents through the system without causing the desired temperature and concentration of the reagents to deviate significantly from predetermined values.
5879734,1999,Nut sheller bypass method,"In a plant for mass mechanical shelling of nuts having a cracker, sheller, and air separators, this process bypasses the sheller with some cracked nuts. Nuts and nut parts created in the cracker are sent to bypass structure where in successive operations, the nuts are separated by width then by thickness. Those nuts having the largest width are shelled by parallel rubber coated cylinders. The remaining nut parts having smaller thickness/width ratios bypass the sheller of the prior art. Parts having larger thickness/width ratios are sent to the sheller of the prior art. The process is performed by screens which separate the cracked nut parts by width. For each width of nut parts, slots between revolving cylinders, separate the larger thickness parts from the smaller thickness parts."
5966790,1999,Separating tool,A tool for separating mutually connected parts which has a head part and at least two spreading elements which are movably connected to the head part in such a way that a force or a pulse applied to the head part is converted in the spreading elements into a force component which is in the same direction and into a force component which is perpendicular thereto and which is operable to move the parts to be separated away from each other.
5931087,1999,"SpencCracker, an apparatus for shucking pecans","An apparatus for shucking pecans having a stator, which is a trapezoidal front plate with a pair of adjoining tapered side-walls with longitudinal edges, a mounting bracket for immobilizing the stator, and a chute which is a reservoir for the pecans, where said stator is axially connected to a rotor, which is a circular back plate that pivots at the centroid of the front plate; the combination of the back plate and the front plate forming a chamber that is narrow at the bottom, wherein the pecans are cracked as the rotor is rocked back and forth through an arc, where the rocking action forces the pecans into compression and then in the reverse rock into relief, where the shell separates from the kernel."
5711212,1998,Apparatus for splitting pistachios,"A process for splitting pistachios including a bin dumper, a sizer, moisturizers, blowers and splitting units arranged in seriatim. The blower removes excess water and particles from the nut surfaces after moisturizing and before splitting. The splitter includes a controlled surge bin having a brush gate associated with a sensor to control flow to a singulator. A vibrated singulator operates to release nuts to a splitting mechanism having opposed elements with cavities aligned to receive the ends of the nuts. Cradles retain the nuts in alignment for compression. Lateral vibration is induced in the cradles to ensure placement of the retained nuts."
