PatentNum,Date,Title,Text
4467711,1984,Method and apparatus for cracking nuts,"The nut cracking apparatus includes a conveyor comprised of a plurality of parallel slats connected to endless chains for intermittent movement from a hopper to a nut gripping and cracking apparatus. Each slat is provided with a row of openings extending therethrough for receiving nuts from the hopper and an underlying support is provided to retain the nuts in the openings until each slat is moved in sequence to a plurality of cracking apparatus. Each nut is located between an upper and lower nut gripping block each of which has a recess therein with a slot in the bottom thereof. The lower nut gripping block is spring biased on a fixed blade to normally have the blade retracted out of the recess. The upper nut gripping block is spring biased on an opposed blade which in turn is connected to the piston of an hydraulically operated piston and cylinder device. The upper nut gripping block is normally biased so that the blade is withdrawn from the recess. Upon lowering of the upper blade toward the lower blade a nut is gripped between the upper and lower blocks and continued downward movement of the blade will cause the upper and lower blades to penetrate into the recesses to cut the shell of the nut into two pieces without damaging the kernel of the nut. A blade position sensing device is provided for limiting the travel of the blade and upon cutting the shell into two pieces, the upper blade is retracted and the upper and lower nut gripping blocks are spring biased back to their normal position. Upon the next stepwise movement of the belt, the slat is moved to a position whereby the shell pieces will drop from the openings in the slat to a container."
4432275,1984,Nut blanching apparatus,"A nut blanching arrangement in which nuts to be blanched are passed between first and second spaced, counter-rotating rollers. Each roller is provided with a plurality of hollow elastic tubular rings extending around its outer circumference. The tubular rings on the first roller are longitudinally aligned with respect to the tubular rings on the second roller such that each four adjacent tubular rings, two on each roller, form an opening through which the nuts pass during the blanching operation. In this arrangement, the nuts passing between the counter-rotating rollers are forced between the grooves of adjacent tubular rings such that the rings encapsulate and compress the nuts as they pass therebetween. The counter-rotating rollers are rotated at slightly different speeds such that during the blanching operation, the slight differential in the roller speeds causes the outer skin of the peanut to peel away from the nut meat."
4438688,1984,Nutcracker,An inclined chute is attachable to a support by means of a base including a clamping arrangement. An inclined base portion supports said chute and also a pair of bearing posts. A drum disposed within the chute is journaled within the bearing posts. Adjustment means enable axial positioning of the bearing posts for adjusting drum and chute clearance to accommodate various sized nuts. A handle imparts rotation to the drum.
4450761,1984,Nutcracker table,"This table is designed to be used for a patented inertia-type nutcracker. Primarily, it consists of a top with legs, and it includes a plurality of openings through it, for supporting receptacles which receive shelled and unshelled nuts. It further includes an opening and a pair of pegs, for rendering the nutcracker stationary when in use."
4462309,1984,Nutcracking machine,"A nutcracking machine is provided which utilizes a cylindrical sizing roll and a cylindrical cracking roll. The sizing roll has a plurality of parallel circumferential grooves, the width and depth of the grooves varying in a predetermined fashion along the length of the roll. The cracking roll has a tractive surface. A spring mounting is used for adjustably and resiliently urging the sizing roll and cracking roll together to allow a predetermined lateral pressure to be exerted on the nuts passing between the rollers. The spring mounting also allows the rollers to separate momentarily to allow passage of foreign objects such as rocks. A separator is used to direct smaller nuts to one portion of the sizing roll and larger nuts to another portion of the sizing roll."
4462156,1984,Pistachio nut opener,An opener for pistachio nuts which is adapted to open both nuts either with small apertures or with large longitudinal apertures. The opener device has a pointed end portion for opening the smaller slot nuts and further includes a longer longitudinal sharp end portion for inserting in a longer slot to force open the nut without damaging the kernel.
4438687,1984,Triphammer nutcracker,"A triphammer nutcracker for use in fracturing the shells of various nuts of differing sizes and shell textures is disclosed. An operating handle is raised and lowered in a pumplike manner to provide access to a cracking chamber wherein the nut to be cracked is placed, to slide a shield completely around the cracking chamber, and to retract and release a spring biased hammer which strikes a pestle with sufficient force to drive the pestle toward the mortar thereby cracking the nut held therebetween. The broken shell fragments fall into a catch basin and any remaining shell and the nut meat fall into the catch basin as the next operating cycle is started. The nutcracker is structured in a manner such that the hammer will not be released to crack the nut until the shield is in place to enclose the cracking chamber thereby preventing flying nut fragments."
4418617,1983,Apparatus for cracking nuts at high production rates,"A high production nutcracking method and apparatus is provided wherein the nuts are fed from a hopper on a feed conveyor, while being singularized and oriented in the hopper. The oriented nuts are thereafter advanced by the conveyor individually in succession to a cracking apparatus, which comprises a plurality of cracking units mounted on a rotatable turret. The rotating cracking units are cyclically controlled so as to clampingly engage and lift each oriented nut from the advancing conveyor, and so as to preserve its orientation. The nut is then cracked and thereafter released at separate spaced points along the circular path of travel of the cracking unit."
4397087,1983,Food-type combination utility device having hammer-like head,"A utility device for use in operating upon shell-type food products such as nuts and shell fish, comprising a transverse head and a pair of handles having one end of each pivotally connected within a recess in said head, the handles having opposed curved recesses adjacent the aforementioned one end of each and also having mating flat surfaces extending from the other ends and abutting each other, in combination with a metal knife blade provided with a unitary handle having a socket extending into the end from which the blade projects, the socket being complementary to the other ends of the pivoted handles and frictionally but separably receiving said other ends and the flat surfaces of said pivoted handles having opposing grooves forming an elongated recess complementary to the shape of the blade and receiving it, whereby the unitary handle serves to utilize the head as a shell-cracking handle."
4389927,1983,Method and apparatus for separating apricot kernels from husks,"In the separation of kernels from the shells of apricot stones the steps of placing at least the medially opened kernels not separated from the shells onto two moving surfaces with the separating gap below the shells, the moving surfaces each moving in an upward direction from the separation gap, and being arranged to carry the said medially separated shells along said separation gap from an input location to an output location."
4377970,1983,Nut cracker,"A nut cracker includes a base that supports an adjustably fixed anvil member and a moveable ram member under the control of a handle, there being a guide interconnecting the ram member with the base which maintains the ram member in an erect position. The confronting faces of the anvil member and the ram member are provided with recesses into which the ends of the nut are received with clearance so that the outer rim of such recesses engage the nut to provide the cracking force to its shell remotely from the ends of the nut. With this construction, a heavy-duty unit is provided which is especially useful for cracking nuts that have hard or strong shells such as black walnuts and butternuts, and the construction further enables the shells to be broken and nut meats recovered in larger pieces without over-cracking."
4378731,1983,Nut cracking device,"A nut cracking device commprising a hammer having an opening for receiving the end of a nut and applying columnar pressure thereon and a plate which faces the hammer for receiving the opposite end of the nut and applying columnar pressure thereon. A spring urges the hammer toward the plate in a cracking process wherein a rotating shaft repeatedly draws and releases the hammer. A turntable, also motivated by the rotating shaft, has an opening for receiving a nut from a reservoir of nuts and transferring that nut to a rest disposed between the hammer and the plate. The rotating shaft also motivates the rest to pivot allowing the nut to fall from the rest after it has been cracked."
4370922,1983,Nutcracker,"A nutcracker which automatically adjusts for nut size. The nut is cracked between a piston and a receiver. The receiver holds the nut and is locked into place by a latching mechanism made up of a plurality of disk elements, stacked together. A locking lever raises one or more disk elements out of place and latches against the flat face of an adjoining disk. A cover may be provided to activate the latching mechanism and cover the nut to be cracked, protecting the user."
4397228,1983,Self-adjusting apparatus for slitting peanuts,"Apparatus is provided for slitting the skins of shelled peanuts, or the like, without splitting the nuts. Peanuts are fed in a single stream into the bite of a pair of rollers mounted one above the other for rotation about parallel horizontal axes. The rollers are driven to carry the stream of nuts into engagement with slitting elements disposed on both sides of the bite of the rollers. The upper roller is carried by a yoke pivoted to a drive shaft and is adapted to rise and fall to and away from the lower roll according to the size of the nut being fed therethrough whereby a substantially constant gripping pressure is applied to the nuts irrespective of the size of the nut. A power drive system connects between the drive shaft and the upper roll."
4325297,1982,Apparatus for buff blanching peanuts,"An apparatus is provided for buff blanching peanuts. The machine is adapted to remove the dark outer skin of shelled peanuts and, at the same time, produce a textured finish on the surface of the nuts to enhance the adhesion of an applied coating such as chocolate or the like. The buff blancher includes a pair of driven parallel rollers having abrasive surfaces and mounted in closely spaced parallel relation with one roller being offset above a lower roller. The rollers are mounted in a housing into one end of which peanuts are delivered for movement along and against the two rollers and discharged at the other end of the housing. The housing may be raised at the feed end in order to provide an incline for the flow of nuts and may be tilted about its longitudinal axis to control the degree of buffing action between the peanuts and the rollers. Baffles are provided to guide the nuts with respect to the rollers and various adjustments are provided for setting the apparatus at a proper angle according to the particular nuts being processed."
4321865,1982,Apparatus for treating nuts or the like,"In treating nuts which are supplied by way of transport means and which are held between two conveyor belts, a groove of uniform depth is milled into the shell of the nut by means of overlapping milling discs, which groove permits the shell of the nut to be broken open by a subsequent splitting means. On the transport means, the nuts are separated and aligned by vibration and the configuration of the guide tracks. A spiral conveyor with a baffle is also provided for this purpose. The conveyor belts are adapted to the different thicknesses of the nuts by means of vertically adjustable rollers. The depth of the groove which is less than the thickness of the shell of the nut is restricted by toothed rings on the milling discs and annular shoulders which are arranged at a displaced position relative thereto radially with respect to the axis of rotation. The milling discs themselves are arranged on pivotal arms or plunger members, wherein the axes of rotation thereof are held by energy storage means at a spacing from each other which is less than double the radius of the two milling discs. The splitting means comprises movable knives with knife blades which increase in thickness and over which the nuts are pushed, being guided in the grooves."
4341152,1982,Contrivance for shelling a granular product,"A contrivance for shelling a granular product, in particular soy beans, sunflower seeds and the like, is provided with a distribution head that is rotatable about its longitudinal axis. This latter displays in its wall axis-symmetrical arranged passthrough openings to which radially oriented guideways () connect. In order to impart a uniform acceleration to all grains, passthrough openings () are structured slot-fashion and extend, at least partially, in the direction of the longitudinal axis in such fashion that the product, with the distribution head () rotating, moves veil-fashion along the guideways ()."
4313374,1982,Machine for hulling nuts,"A machine for hulling nuts having a rotationally driven horizontal disc provided with an upwardly disposed abrasive surface; a cylindrical casing coaxially related to the disc, closely spaced from its periphery, and provided with a discharge opening; a cover closing the casing above the disc and provided with a supply opening adjacent to the discharge opening; and a plurality of blades spaced around the disc and extending generally radially across it to guide nuts deposited in an unhulled condition on the disc through the supply opening in a path around the disc and alternately centrally and peripherally of the disc toward the discharge opening, the hulls being abraded from the kernals as the nuts traverse the path and being urged centrifugally from the disc to fall between it and the casing while the separated kernels exit through the discharge opening."
4322444,1982,Method for de-hulling cacao beans,"The de-hulling of cacao beans is expedited and nib yield increased by treatment with infra-red radiation for a period between one half and two minutes. The radiation preferably has a wavelength between and microns and the treatment may conveniently be carried out by means of apparatus according to British Pat. No. ,,."
4358467,1982,Method for shelling of nuts with a laser beam,"The removal of shells from hard shelled nuts, particularly macadamia nuts, is accomplished by rotating the nut in the path of a high power cw laser beam, such as a CO.sub. laser beam, so as to burn a path around the shell which separates the shell into parts which can readily be removed from the nut. A low power laser beam of a wavelength for which the nut shell and underlying nut meat have substantially different reflectivities, such as a helium-neon laser beam, is arranged to strike the nut collinearly with the high power beam. When the nut meat is exposed as the path in the shell is burned away, the intensity of the low power beam light which is reflected by the nut increases, and this increase is detected to give an indication of the completion of the shell burning operation."
4332827,1982,Method of cracking nuts at high production rates,"A high production nutcracking method and apparatus is provided wherein the nuts are fed from a hopper on a feed conveyor, while being singularized and oriented in the hopper. The oriented nuts are thereafter advanced by the conveyor individually in succession to a cracking apparatus, which comprises a plurality of cracking units mounted on a rotatable turret. The rotating cracking units are cyclically controlled so as to clampingly engage and lift each oriented nut from the advancing conveyor, and so as to preserve its orientation. The nut is then cracked and thereafter released at separate spaced points along the circular path of travel of the cracking unit."
4353931,1982,Method of hulling pistachio nuts,"A pistachio huller is provided wherein a means having projections pushes unhulled nuts between the surface of the means having projections and a surface of a means having slots, the slots being narrower than the pistachio nuts to be hulled. The projections protrude into the slots and the hulls are ruptured and abraded through contact between the surface of the means with projection and the surface of the strips forming the means having slots whereby the nuts are hulled."
4347260,1982,Method of separating almond kernels from almonds with shells,"A method and apparatus for separation of almond kernels where there is a mixture of almond kernels with almond kernels held with or within the shells the method comprising introducing the mixture onto two contra rotating rollers which are rotating upwardly through a separation gap and which have their axis inclined to the horizontal so as to cause feeding of the mixture from an entry location to an exit location, the separation gap being selected so that with the alignment caused by the roller action, almond kernels without shells will pass therethrough while almond kernels with shells will pass along to an exit location. The apparatus provides two contra rotating rollers held the selected distance apart to provide for the separation and being adapted to be contra rotating and includes abutments in the surface to provide an occasional tipping action to almond kernels moving along the surface of the rollers."
4353294,1982,Nut cracking apparatus,Apparatus and method for cracking and/or deshelling nuts or seeds by feeding them between adjacent runs of clockwise and counterclockwise driven belts which carry them against and between vertically spaced pairs of rollers to effectively posture and then to apply cracking pressure to the nuts and seeds along their largest dimension. Similar operating apparatus also has utility for cracking naturally occuring clusters of garlic or shallot bulbs and the like into the individual bulbs.
4317281,1982,Nut opener,"A pocket-sized nut opener serves for separating the shell of a pistachio or similar nut that has an obloid shape and is composed of a mating pair of half shells which enclose a nutmeat and define therebetween a narrow slit. The opener is in the form of a generally spoon-shaped implement with a contour that approximates that of a substantial portion of one of those half shells, the implement defining a tip portion and a base portion opposite the tip portion. A generally flat tab is joined to and projects integrally away from the base portion outwardly from the implement. The tab is of a size to be comfortably grasped merely between a thumb and forefinger of a user when inserting the tip portion into the slit and prying the half shells apart."
4317411,1982,Rotary peanut and blanching apparatus,"Shelled nuts, particularly peanuts, are blanched by depositing the nuts in a stream onto the surface of a horizontal, rotating table. Relatively fixed baffles or vanes having abrasive working faces are positioned slightly above the upper surface of the rotating table and extend generally from the periphery of the table to a point offset from the center thereof, whereby nuts deposited near the outer portion of the table will be carried against the abrasive face of each vane and spin inwardly towards the center of the table as they are being blanched. The center of the table is formed with a well opening into which the blanched nuts are dropped and then fed onto a conveyor by an inclined trough for subsequent handling such as roasting, packaging or the like. The vanes may be curved or straight and may be adjustable to control the blanching action as well as the blanching time. In a modification of the invention, the baffles mounted above the rotating table may be so positioned that nuts deposited near the center of the table will travel outwardly over the edge of the table and be blanched in the process. A trough is provided beyond the periphery of the table to collect the blanched nuts and guide them onto a belt for further processing."
4307660,1981,Device for the cracking of shell fruits,"Machine for cracking shell fruit comprising a rotor () formed of two plates () and () and having cavities (), the axes of the plates () and () being inclined so as to vary the overall size of the cavities (), and furthermore comprising a feed device formed in particular of transfer tubes () and cups () mounted on a disk ()."
4300447,1981,Nut blancher,"A device and a method for either the continuous or the batchwise removal (blanching) of skins from peanuts and other nut products are provided. The nut blanching device includes a rotatable cylinder containing a structure for introducing at least one jet of air along the inside of the cylinder. By placing nuts in this cylinder, nuts are carried along by the rotation of the cylinder into a head-on collision with air from the air jet. The nuts are thus, blanched within the cylinder by a combination of abrasive forces and the force of air."
4255855,1981,Nutcracker,"A nutcracker which includes a plunger slidable in a stationary sleeve, so that an adjustable end of the plunger is exerted against a nut abutted against a rigid anvil, so as to break open the nut shell, a pivotable handle providing a leverage force against the plunger."
4276316,1981,Process for treating nuts,"A process including dry blanching of raw nuts is described. The nuts are heated with a gas at a temperature of .degree. to .degree. C. for to seconds and then immediately cooled to below .degree. C. within minutes prior to blanching. This provides improved blanching, sorting and other steps in a process for producing products ranging from nuts per se to peanut butters or spreads."
4231529,1980,Impact decorticator,"An impact decorticator is disclosed having a rotor, preferably a squirrel-cage rotor, mounted for rotation about a substantially horizontal axis in a generally concentric and cylindrical casing. The casing is provided at the upper portion with an inlet opening and in the lower portion with an outlet opening for the material being processed and graded, substantially horizontally extending ripples are formed on the internal surface of the casing between the inlet and outlet openings (in the direction of rotor rotation), the ripples being graded in that they are spaced progressively closer together, become progressively sharper, become progressively deeper and/or approach more closely from the inlet toward a central zone between the inlet and outlet openings."
4200042,1980,Nut cracker,"First and second levers are pivotally connected together at one end and have opposed portions provided with one or more cross grooves for receiving nuts to be cracked. These grooves have varying depth from one end to the other and also have varying width, thus accommodating a wide range of nut sizes. The grooves also have transverse ribs to hold nuts in place while being cracked. In a preferred structure, the grooves are defined by straight wall segments meeting in angular relation. One of the levers may comprise a base portion for seated support on a supporting surface, and the other lever may comprise a handle for applying leverage."
4201126,1980,Nut cracking apparatus,A transport mechanism for transporting an uncracked nut from a supply of uncracked nuts into a zone between a pair of synchronously movable surfaces which receive the uncracked nut and transfer it to a zone of reduced geometry which results in the imposition of an axial crushing force on the nut is disclosed.
4218968,1980,Nut cracking machine,"A nut cracking machine including a pair of spaced apart cracking plates having confronting cracking faces provided with cracking means thereon, the cracking faces and cracking means thereof being disposed to distribute cracking forces substantially tangentially along the periphery of the shell of a nut received therebetween, for rolling and cracking engagement of a nut, rather than crushing of the same; one of the cracking plates comprising a stationary base plate and the other comprising a rotatable holding plate that is moveable toward and away from the base plate; limit means for initial positioning of the cracking face of the holding plate apart from the cracking face of the base plate according to the proximate diameter of the nut to be cracked, for insertion of a nut therebetween, and thrust means operative on rotation of the holding plate for movement of the holding plate toward the base plate in juxtaposed relation for rolling and cracking engagement of the shell of a nut received therebetween and, on completion of the nut cracking circuit of the holding plate, to return the same to initial positioning thereof, for removal of the nut as cracked between the base plate and the holding plate."
